{"$schema":"https://json-schema.org/draft/2020-12/schema","$id":"taskgate-final-v5-campaign-v1","type":"object","additionalProperties":false,"required":["schema_version","campaign_class","campaign_id","experiment_id","submission_commit","deployments","warmups","samples","random_seed","fresh_root_per_sample","workloads"],"properties":{"schema_version":{"const":1},"campaign_class":{"enum":["pilot","publication"]},"campaign_id":{"type":"string","minLength":1},"experiment_id":{"type":"string"},"submission_commit":{"type":"string"},"deployments":{"type":"integer","minimum":1},"process_replicates":{"type":"integer","minimum":1},"warmups":{"type":"integer","minimum":0},"samples":{"type":"integer","minimum":1},"random_seed":{"type":"integer"},"fresh_root_per_sample":{"type":"boolean"},"kernel_only":{"type":"boolean"},"workloads":{"type":"array","minItems":1}}}
