{
  "schema_version": 1,
  "campaign_class": "publication",
  "campaign_id": "replace-with-unique-campaign-id",
  "experiment_id": "scale",
  "submission_commit": "0000000000000000000000000000000000000000",
  "deployments": 3,
  "warmups": 5,
  "samples": 30,
  "random_seed": 20260801,
  "fresh_root_per_sample": true,
  "workloads": [
    {"id":"dependency-e2e","scales":["10k-overlap-0","10k-overlap-50","10k-overlap-90","10k-overlap-100","100k-overlap-0","100k-overlap-50","100k-overlap-90","100k-overlap-100","1035000-overlap-0","1035000-overlap-50","1035000-overlap-90","1035000-overlap-100"],"modes":["novel","semantic_replay"]},
    {"id":"outcome-merkle","scales":["10k-x1-o0","10k-x1-o50","10k-x1-o90","10k-x1-o100","10k-x100-o0","10k-x100-o50","10k-x100-o90","10k-x100-o100","10k-x10k-o0","10k-x10k-o50","10k-x10k-o90","10k-x10k-o100","100k-x1-o0","100k-x1-o50","100k-x1-o90","100k-x1-o100","100k-x100-o0","100k-x100-o50","100k-x100-o90","100k-x100-o100","100k-x10k-o0","100k-x10k-o50","100k-x10k-o90","100k-x10k-o100","1m-x1-o0","1m-x1-o50","1m-x1-o90","1m-x1-o100","1m-x100-o0","1m-x100-o50","1m-x100-o90","1m-x100-o100","1m-x10k-o0","1m-x10k-o50","1m-x10k-o90","1m-x10k-o100"],"modes":["merkle_control"]}
  ]
}
